<?xml version="1.0" encoding="UTF-8"?>
<root xmlns:xsi="http://www.w3.org/2001/XMLSchema-instance"
      xsi:noNamespaceSchemaLocation="file:///c:/apps/HL7/src/SS_XML_Files/DONT_TOUCH/SS_BIOMED.xsd">
   <TK_test_seq>
      <test_mstr>
         <test_lab_ID>DDI</test_lab_ID>
      </test_mstr>
      <people_mstr>
         <people_lastname>Luttrell</people_lastname>
         <people_firstname>Robert</people_firstname>
         <people_midname>J</people_midname>
         <people_prefname>Ab</people_prefname>
         <people_dob>
            <year>1957</year>
            <month>10</month>
            <day>21</day>
         </people_dob>
         <people_gender>M</people_gender>
         <people_ssn>218688662</people_ssn>
         <people_homephone>510-123-4567</people_homephone>
         <people_workphone>207-787-2000</people_workphone>
      </people_mstr>
      <patient_mstr>
         <patient_notes>Comments - text area</patient_notes>
      </patient_mstr>
      <addr_mstr>
         <addr_addr1>101 Main</addr_addr1>
         <addr_addr2>Apt 201</addr_addr2>
         <addr_city>WALNUT CREEK</addr_city>
         <state_iso>CA</state_iso>
         <addr_zip>94595</addr_zip>
         <country_iso>USA</country_iso>
      </addr_mstr>
      <tk_mstr>
         <TK_ID>110B</TK_ID>
         <tk_lab_sample_ID>F170214-2016-1</tk_lab_sample_ID>
         <tk_test_desc>Fecal Metals</tk_test_desc>
         <coll_begin>
            <year>2015</year>
            <month>10</month>
            <day>21</day>
         </coll_begin>
         <coll_end>
            <year>2015</year>
            <month>10</month>
            <day>22</day>
         </coll_end>
         <volume>10</volume>
      </tk_mstr>
      <tkr_det>
         <set_id>2</set_id>
         <tkr_item>F-As</tkr_item>
         <tkr_result>2.53</tkr_result>
         <tkr_ref_uom>mg/kg Dry Wt</tkr_ref_uom>
         <tkr_lab_ref>&lt;   0.30</tkr_lab_ref>
      </tkr_det>
      <tkr_det>
         <set_id>3</set_id>
         <tkr_item>F-Be</tkr_item>
         <tkr_result>0.011</tkr_result>
         <tkr_ref_uom>mg/kg Dry Wt</tkr_ref_uom>
         <tkr_lab_ref>&lt;  0.009</tkr_lab_ref>
      </tkr_det>
      <tkr_det>
         <set_id>4</set_id>
         <tkr_item>F-Bi</tkr_item>
         <tkr_result>0.052</tkr_result>
         <tkr_ref_uom>mg/kg Dry Wt</tkr_ref_uom>
         <tkr_lab_ref>&lt;  0.050</tkr_lab_ref>
      </tkr_det>
      <tkr_det>
         <set_id>5</set_id>
         <tkr_item>F-Cd</tkr_item>
         <tkr_result>0.31</tkr_result>
         <tkr_ref_uom>mg/kg Dry Wt</tkr_ref_uom>
         <tkr_lab_ref>&lt;   0.50</tkr_lab_ref>
      </tkr_det>
      <tkr_det>
         <set_id>6</set_id>
         <tkr_item>F-Cu</tkr_item>
         <tkr_result>29</tkr_result>
         <tkr_ref_uom>mg/kg Dry Wt</tkr_ref_uom>
         <tkr_lab_ref>&lt;     60</tkr_lab_ref>
      </tkr_det>
      <tkr_det>
         <set_id>7</set_id>
         <tkr_item>F-Hg1</tkr_item>
         <tkr_result>0.223</tkr_result>
         <tkr_ref_uom>mg/kg Dry Wt</tkr_ref_uom>
         <tkr_lab_ref>&lt; 0.05</tkr_lab_ref>
      </tkr_det>
      <tkr_det>
         <set_id>8</set_id>
         <tkr_item>F-Hg2</tkr_item>
         <tkr_result>0.223</tkr_result>
         <tkr_ref_uom>mg/kg Dry Wt</tkr_ref_uom>
         <tkr_lab_ref>&lt; 0.5</tkr_lab_ref>
      </tkr_det>
      <tkr_det>
         <set_id>91</set_id>
         <tkr_item>F-Ni</tkr_item>
         <tkr_result>6.1</tkr_result>
         <tkr_ref_uom>mg/kg Dry Wt</tkr_ref_uom>
         <tkr_lab_ref>&lt;    8.0</tkr_lab_ref>
      </tkr_det>
      <tkr_det>
         <set_id>10</set_id>
         <tkr_item>F-Pb</tkr_item>
         <tkr_result>0.21</tkr_result>
         <tkr_ref_uom>mg/kg Dry Wt</tkr_ref_uom>
         <tkr_lab_ref>&lt;   0.50</tkr_lab_ref>
      </tkr_det>
      <tkr_det>
         <set_id>11</set_id>
         <tkr_item>F-Pt</tkr_item>
         <tkr_result>&lt; dl</tkr_result>
         <tkr_ref_uom>mg/kg Dry Wt</tkr_ref_uom>
         <tkr_lab_ref>&lt;  0.003</tkr_lab_ref>
      </tkr_det>
      <tkr_det>
         <set_id>12</set_id>
         <tkr_item>F-Sb</tkr_item>
         <tkr_result>0.062</tkr_result>
         <tkr_ref_uom>mg/kg Dry Wt</tkr_ref_uom>
         <tkr_lab_ref>&lt;  0.080</tkr_lab_ref>
      </tkr_det>
      <tkr_det>
         <set_id>13</set_id>
         <tkr_item>F-Tl</tkr_item>
         <tkr_result>0.024</tkr_result>
         <tkr_ref_uom>mg/kg Dry Wt</tkr_ref_uom>
         <tkr_lab_ref>&lt;  0.020</tkr_lab_ref>
      </tkr_det>
      <tkr_det>
         <set_id>14</set_id>
         <tkr_item>F-U</tkr_item>
         <tkr_result>0.103</tkr_result>
         <tkr_ref_uom>mg/kg Dry Wt</tkr_ref_uom>
         <tkr_lab_ref>&lt;  0.120</tkr_lab_ref>
      </tkr_det>
      <tkr_det>
         <set_id>15</set_id>
         <tkr_item>F-W</tkr_item>
         <tkr_result>0.369</tkr_result>
         <tkr_ref_uom>mg/kg Dry Wt</tkr_ref_uom>
         <tkr_lab_ref>&lt;  0.090</tkr_lab_ref>
      </tkr_det>
      <tkr_det>
         <set_id>16</set_id>
         <tkr_item>WaterContent</tkr_item>
         <tkr_result>66.4</tkr_result>
         <tkr_ref_uom/>
         <tkr_lab_ref>60-85</tkr_lab_ref>
      </tkr_det>
      <tkr_det>
         <set_id>17</set_id>
         <tkr_item>DetoxificationAgent</tkr_item>
         <tkr_result/>
         <tkr_ref_uom/>
         <tkr_lab_ref/>
      </tkr_det>
      <tkr_det>
         <set_id>18</set_id>
         <tkr_item>Dosage</tkr_item>
         <tkr_result/>
         <tkr_ref_uom/>
         <tkr_lab_ref/>
      </tkr_det>
      <tkr_det>
         <set_id>19</set_id>
         <tkr_item>Provocation</tkr_item>
         <tkr_result/>
         <tkr_ref_uom/>
         <tkr_lab_ref/>
      </tkr_det>
      <tkr_det>
         <set_id>20</set_id>
         <tkr_item>DentalAmalgams</tkr_item>
         <tkr_result>not indicated</tkr_result>
         <tkr_ref_uom/>
         <tkr_lab_ref/>
      </tkr_det>
      <tkr_det>
         <set_id>21</set_id>
         <tkr_item>AmalgamQuantity</tkr_item>
         <tkr_result>0</tkr_result>
         <tkr_ref_uom/>
         <tkr_lab_ref/>
      </tkr_det>
   </TK_test_seq>
</root>