<?xml version="1.0" encoding="UTF-8"?>
<root xmlns:xsi="http://www.w3.org/2001/XMLSchema-instance"
      xsi:noNamespaceSchemaLocation="file:///c:/apps/HL7/src/SS_XML_Files/DONT_TOUCH/SS_BIOMED.xsd">
   <TK_test_seq>
      <test_mstr>
         <test_lab_ID>DDI</test_lab_ID>
      </test_mstr>
      <people_mstr>
         <people_lastname>Webber</people_lastname>
         <people_firstname>Matthew</people_firstname>
         <people_midname>S.</people_midname>
         <people_prefname/>
         <people_dob>
            <year>1991</year>
            <month>02</month>
            <day>02</day>
         </people_dob>
         <people_gender>M</people_gender>
         <people_ssn/>
         <people_homephone>207-374-5801</people_homephone>
         <people_workphone/>
      </people_mstr>
      <patient_mstr>
         <patient_notes>Comments - text area</patient_notes>
      </patient_mstr>
      <addr_mstr>
         <addr_addr1>PO Box 391</addr_addr1>
         <addr_addr2>Route 172</addr_addr2>
         <addr_city>Blue Hill</addr_city>
         <state_iso>ME</state_iso>
         <addr_zip>04614</addr_zip>
         <country_iso>USA</country_iso>
      </addr_mstr>
      <tk_mstr>
         <TK_ID>FM-24195</TK_ID>
         <tk_lab_sample_ID>F170214-2016-1</tk_lab_sample_ID>
         <tk_test_desc>Fecal Metals</tk_test_desc>
         <coll_begin>
            <year>2014</year>
            <month>03</month>
            <day>23</day>
         </coll_begin>
         <coll_end>
            <year>2014</year>
            <month>04</month>
            <day>01</day>
         </coll_end>
         <volume/>
      </tk_mstr>
      <tkr_det>
         <set_id>2</set_id>
         <tkr_item>F-As</tkr_item>
         <tkr_result>0.12</tkr_result>
         <tkr_ref_uom>mg/kg Dry Wt</tkr_ref_uom>
         <tkr_lab_ref>&lt;   0.30</tkr_lab_ref>
      </tkr_det>
      <tkr_det>
         <set_id>3</set_id>
         <tkr_item>F-Be</tkr_item>
         <tkr_result>0.004</tkr_result>
         <tkr_ref_uom>mg/kg Dry Wt</tkr_ref_uom>
         <tkr_lab_ref>&lt;  0.009</tkr_lab_ref>
      </tkr_det>
      <tkr_det>
         <set_id>4</set_id>
         <tkr_item>F-Bi</tkr_item>
         <tkr_result>120.4</tkr_result>
         <tkr_ref_uom>mg/kg Dry Wt</tkr_ref_uom>
         <tkr_lab_ref>&lt;  0.050</tkr_lab_ref>
      </tkr_det>
      <tkr_det>
         <set_id>5</set_id>
         <tkr_item>F-Cd</tkr_item>
         <tkr_result>0.14</tkr_result>
         <tkr_ref_uom>mg/kg Dry Wt</tkr_ref_uom>
         <tkr_lab_ref>&lt;   0.50</tkr_lab_ref>
      </tkr_det>
      <tkr_det>
         <set_id>6</set_id>
         <tkr_item>F-Cu</tkr_item>
         <tkr_result>31</tkr_result>
         <tkr_ref_uom>mg/kg Dry Wt</tkr_ref_uom>
         <tkr_lab_ref>&lt;     60</tkr_lab_ref>
      </tkr_det>
      <tkr_det>
         <set_id>7</set_id>
         <tkr_item>F-Hg1</tkr_item>
         <tkr_result>0.024</tkr_result>
         <tkr_ref_uom>mg/kg Dry Wt</tkr_ref_uom>
         <tkr_lab_ref>&lt; 0.05</tkr_lab_ref>
      </tkr_det>
      <tkr_det>
         <set_id>8</set_id>
         <tkr_item>F-Hg2</tkr_item>
         <tkr_result>0.024</tkr_result>
         <tkr_ref_uom>mg/kg Dry Wt</tkr_ref_uom>
         <tkr_lab_ref>&lt; 0.5</tkr_lab_ref>
      </tkr_det>
      <tkr_det>
         <set_id>91</set_id>
         <tkr_item>F-Ni</tkr_item>
         <tkr_result>3.5</tkr_result>
         <tkr_ref_uom>mg/kg Dry Wt</tkr_ref_uom>
         <tkr_lab_ref>&lt;    8.0</tkr_lab_ref>
      </tkr_det>
      <tkr_det>
         <set_id>10</set_id>
         <tkr_item>F-Pb</tkr_item>
         <tkr_result>0.20</tkr_result>
         <tkr_ref_uom>mg/kg Dry Wt</tkr_ref_uom>
         <tkr_lab_ref>&lt;   0.50</tkr_lab_ref>
      </tkr_det>
      <tkr_det>
         <set_id>11</set_id>
         <tkr_item>F-Pt</tkr_item>
         <tkr_result>&lt; dl</tkr_result>
         <tkr_ref_uom>mg/kg Dry Wt</tkr_ref_uom>
         <tkr_lab_ref>&lt;  0.003</tkr_lab_ref>
      </tkr_det>
      <tkr_det>
         <set_id>12</set_id>
         <tkr_item>F-Sb</tkr_item>
         <tkr_result>0.076</tkr_result>
         <tkr_ref_uom>mg/kg Dry Wt</tkr_ref_uom>
         <tkr_lab_ref>&lt;  0.080</tkr_lab_ref>
      </tkr_det>
      <tkr_det>
         <set_id>13</set_id>
         <tkr_item>F-Tl</tkr_item>
         <tkr_result>0.024</tkr_result>
         <tkr_ref_uom>mg/kg Dry Wt</tkr_ref_uom>
         <tkr_lab_ref>&lt;  0.020</tkr_lab_ref>
      </tkr_det>
      <tkr_det>
         <set_id>14</set_id>
         <tkr_item>F-U</tkr_item>
         <tkr_result>0.643</tkr_result>
         <tkr_ref_uom>mg/kg Dry Wt</tkr_ref_uom>
         <tkr_lab_ref>&lt;  0.120</tkr_lab_ref>
      </tkr_det>
      <tkr_det>
         <set_id>15</set_id>
         <tkr_item>F-W</tkr_item>
         <tkr_result>0.221</tkr_result>
         <tkr_ref_uom>mg/kg Dry Wt</tkr_ref_uom>
         <tkr_lab_ref>&lt;  0.090</tkr_lab_ref>
      </tkr_det>
      <tkr_det>
         <set_id>16</set_id>
         <tkr_item>WaterContent</tkr_item>
         <tkr_result>74.8</tkr_result>
         <tkr_ref_uom/>
         <tkr_lab_ref>60-85</tkr_lab_ref>
      </tkr_det>
      <tkr_det>
         <set_id>17</set_id>
         <tkr_item>DetoxificationAgent</tkr_item>
         <tkr_result/>
         <tkr_ref_uom/>
         <tkr_lab_ref/>
      </tkr_det>
      <tkr_det>
         <set_id>18</set_id>
         <tkr_item>Dosage</tkr_item>
         <tkr_result/>
         <tkr_ref_uom/>
         <tkr_lab_ref/>
      </tkr_det>
      <tkr_det>
         <set_id>19</set_id>
         <tkr_item>Provocation</tkr_item>
         <tkr_result/>
         <tkr_ref_uom/>
         <tkr_lab_ref/>
      </tkr_det>
      <tkr_det>
         <set_id>20</set_id>
         <tkr_item>DentalAmalgams</tkr_item>
         <tkr_result>not indicated</tkr_result>
         <tkr_ref_uom/>
         <tkr_lab_ref/>
      </tkr_det>
      <tkr_det>
         <set_id>21</set_id>
         <tkr_item>AmalgamQuantity</tkr_item>
         <tkr_result>0</tkr_result>
         <tkr_ref_uom/>
         <tkr_lab_ref/>
      </tkr_det>
   </TK_test_seq>
</root>