<?xml version="1.0" encoding="UTF-8"?>
<root xmlns:xsi="http://www.w3.org/2001/XMLSchema-instance"
      xsi:noNamespaceSchemaLocation="file:///c:/apps/HL7/src/SS_XML_Files/DONT_TOUCH/SS_BIOMED.xsd">
   <TK_test_seq>
      <test_mstr>
         <test_lab_ID>DDI</test_lab_ID>
      </test_mstr>
      <people_mstr>
         <people_lastname>Krashlansky</people_lastname>
         <people_firstname>Leo</people_firstname>
         <people_midname/>
         <people_prefname/>
         <people_dob>
            <year>2006</year>
            <month>08</month>
            <day>07</day>
         </people_dob>
         <people_gender>M</people_gender>
         <people_ssn/>
         <people_homephone/>
         <people_workphone/>
      </people_mstr>
      <patient_mstr>
         <patient_notes/>
      </patient_mstr>
      <addr_mstr>
         <addr_addr1>1959 Blake Ave Unit L</addr_addr1>
         <addr_addr2/>
         <addr_city>LOS ANGELES</addr_city>
         <state_iso>CA</state_iso>
         <addr_zip>90039</addr_zip>
         <country_iso>USA</country_iso>
      </addr_mstr>
      <tk_mstr>
         <TK_ID>UI-69018</TK_ID>
         <tk_lab_sample_ID>U170503-2015-1</tk_lab_sample_ID>
         <tk_test_desc>Neuro-Biogenic Amines, Comprehensive; urine  second morning void</tk_test_desc>
         <coll_begin>
            <year>2017</year>
            <month>04</month>
            <day>30</day>
         </coll_begin>
         <coll_end>
            <year>2017</year>
            <month>05</month>
            <day>01</day>
         </coll_end>
         <volume/>
      </tk_mstr>
      <tkr_det>
         <set_id>1</set_id>
         <tkr_item>Dopamine, free</tkr_item>
         <tkr_result>1230</tkr_result>
         <tkr_ref_uom>µg/g</tkr_ref_uom>
         <tkr_lab_ref>75-   450</tkr_lab_ref>
      </tkr_det>
      <tkr_det>
         <set_id>2</set_id>
         <tkr_item>3,4-Dihydroxyphenylacetic acid (DOPAC)</tkr_item>
         <tkr_result>9673</tkr_result>
         <tkr_ref_uom>µg/g</tkr_ref_uom>
         <tkr_lab_ref>480-  2600</tkr_lab_ref>
      </tkr_det>
      <tkr_det>
         <set_id>3</set_id>
         <tkr_item>3-Methoxytyramine (3-MT)</tkr_item>
         <tkr_result>721</tkr_result>
         <tkr_ref_uom>nmol/g</tkr_ref_uom>
         <tkr_lab_ref>40-   330</tkr_lab_ref>
      </tkr_det>
      <tkr_det>
         <set_id>4</set_id>
         <tkr_item>Norepinephrine, free</tkr_item>
         <tkr_result>25.9</tkr_result>
         <tkr_ref_uom>µg/g</tkr_ref_uom>
         <tkr_lab_ref>20-   104</tkr_lab_ref>
      </tkr_det>
      <tkr_det>
         <set_id>5</set_id>
         <tkr_item>Normetanephrine</tkr_item>
         <tkr_result>196</tkr_result>
         <tkr_ref_uom>µg/g</tkr_ref_uom>
         <tkr_lab_ref>140-   740</tkr_lab_ref>
      </tkr_det>
      <tkr_det>
         <set_id>6</set_id>
         <tkr_item>Epinephrine, free</tkr_item>
         <tkr_result>15</tkr_result>
         <tkr_ref_uom>µg/g</tkr_ref_uom>
         <tkr_lab_ref>1.6-    18</tkr_lab_ref>
      </tkr_det>
      <tkr_det>
         <set_id>7</set_id>
         <tkr_item>Metanephrine</tkr_item>
         <tkr_result>195</tkr_result>
         <tkr_ref_uom>µg/g</tkr_ref_uom>
         <tkr_lab_ref>50-   270</tkr_lab_ref>
      </tkr_det>
      <tkr_det>
         <set_id>8</set_id>
         <tkr_item>Serotonin</tkr_item>
         <tkr_result>121</tkr_result>
         <tkr_ref_uom>µg/g</tkr_ref_uom>
         <tkr_lab_ref>70-   350</tkr_lab_ref>
      </tkr_det>
      <tkr_det>
         <set_id>9</set_id>
         <tkr_item>5-Hydroxyindolacetic acid (5-HIAA)</tkr_item>
         <tkr_result>8452</tkr_result>
         <tkr_ref_uom>µg/g</tkr_ref_uom>
         <tkr_lab_ref>1250- 11000</tkr_lab_ref>
      </tkr_det>
      <tkr_det>
         <set_id>10</set_id>
         <tkr_item>Tryptamine</tkr_item>
         <tkr_result>1.3</tkr_result>
         <tkr_ref_uom>µmol/g</tkr_ref_uom>
         <tkr_lab_ref>0.6-   1.8</tkr_lab_ref>
      </tkr_det>
      <tkr_det>
         <set_id>11</set_id>
         <tkr_item>Glutamate</tkr_item>
         <tkr_result>43</tkr_result>
         <tkr_ref_uom>µmol/g</tkr_ref_uom>
         <tkr_lab_ref>10-    80</tkr_lab_ref>
      </tkr_det>
      <tkr_det>
         <set_id>12</set_id>
         <tkr_item>Gamma-aminobutyrate (GABA)</tkr_item>
         <tkr_result>6.0</tkr_result>
         <tkr_ref_uom>µmol/g</tkr_ref_uom>
         <tkr_lab_ref>1-    10</tkr_lab_ref>
      </tkr_det>
      <tkr_det>
         <set_id>13</set_id>
         <tkr_item>Tyrosine</tkr_item>
         <tkr_result>265</tkr_result>
         <tkr_ref_uom>µmol/g</tkr_ref_uom>
         <tkr_lab_ref>60-   225</tkr_lab_ref>
      </tkr_det>
      <tkr_det>
         <set_id>14</set_id>
         <tkr_item>Tyramine</tkr_item>
         <tkr_result>5.9</tkr_result>
         <tkr_ref_uom>µmol/g</tkr_ref_uom>
         <tkr_lab_ref>2.4-    11</tkr_lab_ref>
      </tkr_det>
      <tkr_det>
         <set_id>15</set_id>
         <tkr_item>Phenethylamine (PEA)</tkr_item>
         <tkr_result>60</tkr_result>
         <tkr_ref_uom>nmol/g</tkr_ref_uom>
         <tkr_lab_ref>21-   200</tkr_lab_ref>
      </tkr_det>
      <tkr_det>
         <set_id>16</set_id>
         <tkr_item>Taurine</tkr_item>
         <tkr_result>3644</tkr_result>
         <tkr_ref_uom>µmol/g</tkr_ref_uom>
         <tkr_lab_ref>200-  1600</tkr_lab_ref>
      </tkr_det>
      <tkr_det>
         <set_id>17</set_id>
         <tkr_item>Glycine</tkr_item>
         <tkr_result>6974</tkr_result>
         <tkr_ref_uom>µmol/g</tkr_ref_uom>
         <tkr_lab_ref>560-  3400</tkr_lab_ref>
      </tkr_det>
      <tkr_det>
         <set_id>18</set_id>
         <tkr_item>Histamine</tkr_item>
         <tkr_result>34</tkr_result>
         <tkr_ref_uom>µg/g</tkr_ref_uom>
         <tkr_lab_ref>8-    80</tkr_lab_ref>
      </tkr_det>
      <tkr_det>
         <set_id>19</set_id>
         <tkr_item>U-CREAT</tkr_item>
         <tkr_result>16</tkr_result>
         <tkr_ref_uom>mg/dL</tkr_ref_uom>
         <tkr_lab_ref>25-   180</tkr_lab_ref>
      </tkr_det>
      <tkr_det>
         <set_id>20</set_id>
         <tkr_item>U-Vol 24hr</tkr_item>
         <tkr_result/>
         <tkr_ref_uom>mL</tkr_ref_uom>
         <tkr_lab_ref/>
      </tkr_det>
      <tkr_det>
         <set_id>21</set_id>
         <tkr_item>Time Collected</tkr_item>
         <tkr_result/>
         <tkr_ref_uom/>
         <tkr_lab_ref/>
      </tkr_det>
      <tkr_det>
         <set_id>22</set_id>
         <tkr_item>Col Period</tkr_item>
         <tkr_result> second morning void</tkr_result>
         <tkr_ref_uom>Hours</tkr_ref_uom>
         <tkr_lab_ref/>
      </tkr_det>
      <tkr_det>
         <set_id>23</set_id>
         <tkr_item>Body Surface Area</tkr_item>
         <tkr_result/>
         <tkr_ref_uom/>
         <tkr_lab_ref/>
      </tkr_det>
   </TK_test_seq>
</root>