<?xml version="1.0" encoding="UTF-8"?>
<root xmlns:xsi="http://www.w3.org/2001/XMLSchema-instance"
      xsi:noNamespaceSchemaLocation="file:///c:/apps/HL7/src/SS_XML_Files/DONT_TOUCH/SS_BIOMED.xsd">
   <TK_test_seq>
      <test_mstr>
         <test_lab_ID>DDI</test_lab_ID>
      </test_mstr>
      <people_mstr>
         <people_lastname>Lal</people_lastname>
         <people_firstname>Sahib</people_firstname>
         <people_midname/>
         <people_prefname/>
         <people_dob>
            <year>2008</year>
            <month>08</month>
            <day>03</day>
         </people_dob>
         <people_gender>M</people_gender>
         <people_ssn/>
         <people_homephone/>
         <people_workphone/>
      </people_mstr>
      <patient_mstr>
         <patient_notes/>
      </patient_mstr>
      <addr_mstr>
         <addr_addr1/>
         <addr_addr2/>
         <addr_city/>
         <state_iso/>
         <addr_zip/>
         <country_iso/>
      </addr_mstr>
      <tk_mstr>
         <TK_ID>UP-39029</TK_ID>
         <tk_lab_sample_ID>U170224-2135-1</tk_lab_sample_ID>
         <tk_test_desc>Urine Porphyrins</tk_test_desc>
         <coll_begin>
            <year>2017</year>
            <month>02</month>
            <day>22</day>
         </coll_begin>
         <coll_end>
            <year>2017</year>
            <month>03</month>
            <day>01</day>
         </coll_end>
         <volume/>
      </tk_mstr>
      <tkr_det>
         <set_id>2</set_id>
         <tkr_item>Uroporphyrins/Creat</tkr_item>
         <tkr_result>220</tkr_result>
         <tkr_ref_uom>nmol/g Creat</tkr_ref_uom>
         <tkr_lab_ref>&lt;     30</tkr_lab_ref>
      </tkr_det>
      <tkr_det>
         <set_id>3</set_id>
         <tkr_item>Heptacarboxylporphyrins/Creat</tkr_item>
         <tkr_result>3.9</tkr_result>
         <tkr_ref_uom>nmol/g Creat</tkr_ref_uom>
         <tkr_lab_ref>&lt;      6</tkr_lab_ref>
      </tkr_det>
      <tkr_det>
         <set_id>4</set_id>
         <tkr_item>Hexacarboyxlporphyrins/Creat</tkr_item>
         <tkr_result>0.6</tkr_result>
         <tkr_ref_uom>nmol/g Creat</tkr_ref_uom>
         <tkr_lab_ref>&lt;    5.2</tkr_lab_ref>
      </tkr_det>
      <tkr_det>
         <set_id>5</set_id>
         <tkr_item>Pentacarboxylporphyrins/Creat</tkr_item>
         <tkr_result>1.2</tkr_result>
         <tkr_ref_uom>nmol/g Creat</tkr_ref_uom>
         <tkr_lab_ref>&lt;    4.5</tkr_lab_ref>
      </tkr_det>
      <tkr_det>
         <set_id>6</set_id>
         <tkr_item>CoproporphyrinI/Creat</tkr_item>
         <tkr_result>29</tkr_result>
         <tkr_ref_uom>nmol/g Creat</tkr_ref_uom>
         <tkr_lab_ref>&lt;     36</tkr_lab_ref>
      </tkr_det>
      <tkr_det>
         <set_id>7</set_id>
         <tkr_item>CoproporphyrinIII/Creat</tkr_item>
         <tkr_result>130</tkr_result>
         <tkr_ref_uom>nmol/g Creat</tkr_ref_uom>
         <tkr_lab_ref>&lt;    105</tkr_lab_ref>
      </tkr_det>
      <tkr_det>
         <set_id>8</set_id>
         <tkr_item>CoproI_CoproIII_ratio/Creat</tkr_item>
         <tkr_result>0.21</tkr_result>
         <tkr_ref_uom>nmol/g Creat</tkr_ref_uom>
         <tkr_lab_ref>&lt;    0.8</tkr_lab_ref>
      </tkr_det>
      <tkr_det>
         <set_id>9</set_id>
         <tkr_item>Total_Porphyrins/Creat</tkr_item>
         <tkr_result>390</tkr_result>
         <tkr_ref_uom>nmol/g Creat</tkr_ref_uom>
         <tkr_lab_ref>&lt;    160</tkr_lab_ref>
      </tkr_det>
      <tkr_det>
         <set_id>10</set_id>
         <tkr_item>PrecoproporphyrinI/Creat</tkr_item>
         <tkr_result>2.1</tkr_result>
         <tkr_ref_uom>nmol/g Creat</tkr_ref_uom>
         <tkr_lab_ref>&lt;      2</tkr_lab_ref>
      </tkr_det>
      <tkr_det>
         <set_id>11</set_id>
         <tkr_item>PrecoproporphyrinII/Creat</tkr_item>
         <tkr_result>1</tkr_result>
         <tkr_ref_uom>nmol/g Creat</tkr_ref_uom>
         <tkr_lab_ref>&lt;    1.2</tkr_lab_ref>
      </tkr_det>
      <tkr_det>
         <set_id>12</set_id>
         <tkr_item>PrecoproporphyrinIII/Creat</tkr_item>
         <tkr_result>0</tkr_result>
         <tkr_ref_uom>nmol/g Creat</tkr_ref_uom>
         <tkr_lab_ref>&lt;    1.2</tkr_lab_ref>
      </tkr_det>
      <tkr_det>
         <set_id>13</set_id>
         <tkr_item>Total_Precoproporphyrins/Creat</tkr_item>
         <tkr_result>3.1</tkr_result>
         <tkr_ref_uom>nmol/g Creat</tkr_ref_uom>
         <tkr_lab_ref>&lt;      4</tkr_lab_ref>
      </tkr_det>
      <tkr_det>
         <set_id>14</set_id>
         <tkr_item>Precopro/Uroporph_ratio/Creat</tkr_item>
         <tkr_result>0.014</tkr_result>
         <tkr_ref_uom>nmol/g Creat</tkr_ref_uom>
         <tkr_lab_ref>&lt;    0.1</tkr_lab_ref>
      </tkr_det>
      <tkr_det>
         <set_id>22</set_id>
         <tkr_item>Creatinine-CREAT</tkr_item>
         <tkr_result>137</tkr_result>
         <tkr_ref_uom>mg/dL</tkr_ref_uom>
         <tkr_lab_ref>25-   180</tkr_lab_ref>
      </tkr_det>
      <tkr_det>
         <set_id>23</set_id>
         <tkr_item>U-Vol 24hr</tkr_item>
         <tkr_result/>
         <tkr_ref_uom>mL</tkr_ref_uom>
         <tkr_lab_ref/>
      </tkr_det>
      <tkr_det>
         <set_id>24</set_id>
         <tkr_item>Col Period</tkr_item>
         <tkr_result>Random</tkr_result>
         <tkr_ref_uom>Hours</tkr_ref_uom>
         <tkr_lab_ref/>
      </tkr_det>
      <tkr_det>
         <set_id>25</set_id>
         <tkr_item>Provocation</tkr_item>
         <tkr_result/>
         <tkr_ref_uom/>
         <tkr_lab_ref/>
      </tkr_det>
   </TK_test_seq>
</root>