<?xml version="1.0" encoding="UTF-8"?>
<root xmlns:xsi="http://www.w3.org/2001/XMLSchema-instance"
      xsi:noNamespaceSchemaLocation="file:///c:/apps/HL7/src/SS_XML_Files/DONT_TOUCH/SS_BIOMED.xsd">
   <TK_test_seq>
      <test_mstr>
         <test_lab_ID>DDI</test_lab_ID>
      </test_mstr>
      <people_mstr>
         <people_lastname>Hamilton</people_lastname>
         <people_firstname>Jonas</people_firstname>
         <people_midname/>
         <people_prefname/>
         <people_dob>
            <year>1996</year>
            <month>05</month>
            <day>27</day>
         </people_dob>
         <people_gender>M</people_gender>
         <people_ssn>009803949</people_ssn>
         <people_homephone>802-492-3792</people_homephone>
         <people_workphone/>
      </people_mstr>
      <patient_mstr>
         <patient_notes/>
      </patient_mstr>
      <addr_mstr>
         <addr_addr1>63 Copperas Hill Rd</addr_addr1>
         <addr_addr2/>
         <addr_city>SHREWSBURY</addr_city>
         <state_iso>VT</state_iso>
         <addr_zip>05738</addr_zip>
         <country_iso>USA</country_iso>
      </addr_mstr>
      <tk_mstr>
         <TK_ID>NC-69029</TK_ID>
         <tk_lab_sample_ID>U170410-2191-1</tk_lab_sample_ID>
         <tk_test_desc>Neuro-Biogenic Amines, Comprehensive; urine  first morning void</tk_test_desc>
         <coll_begin>
            <year>2017</year>
            <month>04</month>
            <day>05</day>
         </coll_begin>
         <coll_end>
            <year>2017</year>
            <month>04</month>
            <day>06</day>
         </coll_end>
         <volume/>
      </tk_mstr>
      <tkr_det>
         <set_id>1</set_id>
         <tkr_item>Dopamine, free</tkr_item>
         <tkr_result>181</tkr_result>
         <tkr_ref_uom>µg</tkr_ref_uom>
         <tkr_lab_ref>52-   320</tkr_lab_ref>
      </tkr_det>
      <tkr_det>
         <set_id>2</set_id>
         <tkr_item>3,4-Dihydroxyphenylacetic acid (DOPAC)</tkr_item>
         <tkr_result>1421</tkr_result>
         <tkr_ref_uom>µg</tkr_ref_uom>
         <tkr_lab_ref>360-  1950</tkr_lab_ref>
      </tkr_det>
      <tkr_det>
         <set_id>3</set_id>
         <tkr_item>3-Methoxytyramine (3-MT)</tkr_item>
         <tkr_result>155</tkr_result>
         <tkr_ref_uom>nmol</tkr_ref_uom>
         <tkr_lab_ref>25-   200</tkr_lab_ref>
      </tkr_det>
      <tkr_det>
         <set_id>4</set_id>
         <tkr_item>Norepinephrine, free</tkr_item>
         <tkr_result>21.1</tkr_result>
         <tkr_ref_uom>µg</tkr_ref_uom>
         <tkr_lab_ref>12-    64</tkr_lab_ref>
      </tkr_det>
      <tkr_det>
         <set_id>5</set_id>
         <tkr_item>Normetanephrine</tkr_item>
         <tkr_result>170</tkr_result>
         <tkr_ref_uom>µg</tkr_ref_uom>
         <tkr_lab_ref>64-   400</tkr_lab_ref>
      </tkr_det>
      <tkr_det>
         <set_id>6</set_id>
         <tkr_item>Epinephrine, free</tkr_item>
         <tkr_result>7.8</tkr_result>
         <tkr_ref_uom>µg</tkr_ref_uom>
         <tkr_lab_ref>1.2-    16</tkr_lab_ref>
      </tkr_det>
      <tkr_det>
         <set_id>7</set_id>
         <tkr_item>Metanephrine</tkr_item>
         <tkr_result>155</tkr_result>
         <tkr_ref_uom>µg</tkr_ref_uom>
         <tkr_lab_ref>35-   200</tkr_lab_ref>
      </tkr_det>
      <tkr_det>
         <set_id>8</set_id>
         <tkr_item>Serotonin</tkr_item>
         <tkr_result>65.3</tkr_result>
         <tkr_ref_uom>µg</tkr_ref_uom>
         <tkr_lab_ref>40-   200</tkr_lab_ref>
      </tkr_det>
      <tkr_det>
         <set_id>9</set_id>
         <tkr_item>5-Hydroxyindolacetic acid (5-HIAA)</tkr_item>
         <tkr_result>2208</tkr_result>
         <tkr_ref_uom>µg</tkr_ref_uom>
         <tkr_lab_ref>800-  7200</tkr_lab_ref>
      </tkr_det>
      <tkr_det>
         <set_id>10</set_id>
         <tkr_item>Tryptamine</tkr_item>
         <tkr_result>0.20</tkr_result>
         <tkr_ref_uom>µmol</tkr_ref_uom>
         <tkr_lab_ref>0.15-   1.1</tkr_lab_ref>
      </tkr_det>
      <tkr_det>
         <set_id>11</set_id>
         <tkr_item>Glutamate</tkr_item>
         <tkr_result>17</tkr_result>
         <tkr_ref_uom>µmol</tkr_ref_uom>
         <tkr_lab_ref>5-    45</tkr_lab_ref>
      </tkr_det>
      <tkr_det>
         <set_id>12</set_id>
         <tkr_item>Gamma-aminobutyrate (GABA)</tkr_item>
         <tkr_result>3.3</tkr_result>
         <tkr_ref_uom>µmol</tkr_ref_uom>
         <tkr_lab_ref>1-   6.5</tkr_lab_ref>
      </tkr_det>
      <tkr_det>
         <set_id>13</set_id>
         <tkr_item>Tyrosine</tkr_item>
         <tkr_result>27</tkr_result>
         <tkr_ref_uom>µmol</tkr_ref_uom>
         <tkr_lab_ref>23-   113</tkr_lab_ref>
      </tkr_det>
      <tkr_det>
         <set_id>14</set_id>
         <tkr_item>Tyramine</tkr_item>
         <tkr_result>1.6</tkr_result>
         <tkr_ref_uom>µmol</tkr_ref_uom>
         <tkr_lab_ref>1.2-   5.5</tkr_lab_ref>
      </tkr_det>
      <tkr_det>
         <set_id>15</set_id>
         <tkr_item>Phenethylamine (PEA)</tkr_item>
         <tkr_result>20</tkr_result>
         <tkr_ref_uom>nmol</tkr_ref_uom>
         <tkr_lab_ref>13-   130</tkr_lab_ref>
      </tkr_det>
      <tkr_det>
         <set_id>16</set_id>
         <tkr_item>Taurine</tkr_item>
         <tkr_result>514</tkr_result>
         <tkr_ref_uom>µmol</tkr_ref_uom>
         <tkr_lab_ref>170-  1200</tkr_lab_ref>
      </tkr_det>
      <tkr_det>
         <set_id>17</set_id>
         <tkr_item>Glycine</tkr_item>
         <tkr_result>532</tkr_result>
         <tkr_ref_uom>µmol</tkr_ref_uom>
         <tkr_lab_ref>280-  2800</tkr_lab_ref>
      </tkr_det>
      <tkr_det>
         <set_id>18</set_id>
         <tkr_item>Histamine</tkr_item>
         <tkr_result>19</tkr_result>
         <tkr_ref_uom>µg</tkr_ref_uom>
         <tkr_lab_ref>5-    48</tkr_lab_ref>
      </tkr_det>
      <tkr_det>
         <set_id>19</set_id>
         <tkr_item>U-CREAT</tkr_item>
         <tkr_result>89</tkr_result>
         <tkr_ref_uom>mg/dL</tkr_ref_uom>
         <tkr_lab_ref>35-   240</tkr_lab_ref>
      </tkr_det>
      <tkr_det>
         <set_id>20</set_id>
         <tkr_item>U-Vol 24hr</tkr_item>
         <tkr_result/>
         <tkr_ref_uom>mL</tkr_ref_uom>
         <tkr_lab_ref/>
      </tkr_det>
      <tkr_det>
         <set_id>21</set_id>
         <tkr_item>Time Collected</tkr_item>
         <tkr_result>12:30 PM</tkr_result>
         <tkr_ref_uom/>
         <tkr_lab_ref/>
      </tkr_det>
      <tkr_det>
         <set_id>22</set_id>
         <tkr_item>Col Period</tkr_item>
         <tkr_result> first morning void</tkr_result>
         <tkr_ref_uom>Hours</tkr_ref_uom>
         <tkr_lab_ref/>
      </tkr_det>
      <tkr_det>
         <set_id>23</set_id>
         <tkr_item>Body Surface Area</tkr_item>
         <tkr_result>2.03</tkr_result>
         <tkr_ref_uom/>
         <tkr_lab_ref/>
      </tkr_det>
   </TK_test_seq>
</root>