<?xml version="1.0" encoding="UTF-8"?>
<root xmlns:xsi="http://www.w3.org/2001/XMLSchema-instance" xsi:noNamespaceSchemaLocation="SS_BIOMED.xsd">
	<TK_test_seq>
		<test_mstr>
			<test_lab_ID>DDI</test_lab_ID>
		</test_mstr>
		<people_mstr>
			<people_lastname>Lincon</people_lastname>
			<people_firstname>Abraham</people_firstname>
			<people_midname>J</people_midname>
			<people_prefname>Ab</people_prefname>
			<people_dob>
				<year>1957</year>
				<month>10</month>
				<day>21</day>
			</people_dob>
			<people_gender>M</people_gender>
			<people_ssn>218688662</people_ssn>
			<people_homephone>510-123-4567</people_homephone>
			<people_workphone>207-787-2000</people_workphone>
		</people_mstr>
		<patient_mstr>
			<patient_notes>Comments - text area</patient_notes>
		</patient_mstr>
		<addr_mstr>
			<addr_addr1>101 Main</addr_addr1>
			<addr_addr2>Apt 201</addr_addr2>
			<addr_city>WALNUT CREEK</addr_city>
			<state_iso>CA</state_iso>
			<addr_zip>94595</addr_zip>
			<country_iso>USA</country_iso>
		</addr_mstr>
		<tk_mstr>
			<TK_ID>UTM-123456</TK_ID>
			<tk_lab_sample_ID>U170125-2073-1</tk_lab_sample_ID>
			<tk_test_desc>Urine Toxic Metals</tk_test_desc>
			<coll_begin>
				<year>2015</year>
				<month>10</month>
				<day>21</day>
			</coll_begin>
			<coll_end>
				<year>2015</year>
				<month>10</month>
				<day>22</day>
			</coll_end>
			<volume>10</volume>
		</tk_mstr>
		<tkr_det>
			<set_id>1</set_id>
			<tkr_item>U-As/Creat</tkr_item>
			<tkr_result>&lt; dl</tkr_result>
			<tkr_ref_uom>ug/g Creat</tkr_ref_uom>
			<tkr_lab_ref>&lt; 1</tkr_lab_ref>
		</tkr_det>
	</TK_test_seq>
	<TK_test_seq>
		<test_mstr>
			<test_lab_ID>DDI</test_lab_ID>
		</test_mstr>
		<people_mstr>
			<people_lastname>Lincon</people_lastname>
			<people_firstname>Abraham</people_firstname>
			<people_midname>J</people_midname>
			<people_prefname>Ab</people_prefname>
			<people_dob>
				<year>1957</year>
				<month>10</month>
				<day>21</day>
			</people_dob>
			<people_gender>M</people_gender>
			<people_ssn>218688662</people_ssn>
			<people_homephone>510-123-4567</people_homephone>
			<people_workphone>207-787-2000</people_workphone>
		</people_mstr>
		<patient_mstr>
			<patient_notes>Comments - text area</patient_notes>
		</patient_mstr>
		<addr_mstr>
			<addr_addr1>101 Main</addr_addr1>
			<addr_addr2>Apt 201</addr_addr2>
			<addr_city>WALNUT CREEK</addr_city>
			<state_iso>CA</state_iso>
			<addr_zip>94595</addr_zip>
			<country_iso>USA</country_iso>
		</addr_mstr>
		<tk_mstr>
			<TK_ID>UTM-123456</TK_ID>
			<tk_lab_sample_ID>U170125-2073-1</tk_lab_sample_ID>
			<tk_test_desc>Urine Toxic Metals</tk_test_desc>
			<coll_begin>
				<year>2015</year>
				<month>10</month>
				<day>21</day>
			</coll_begin>
			<coll_end>
				<year>2015</year>
				<month>10</month>
				<day>22</day>
			</coll_end>
			<volume>10</volume>
		</tk_mstr>
		<tkr_det>
			<set_id>1</set_id>
			<tkr_item>U-As/Creat</tkr_item>
			<tkr_result>&lt; dl</tkr_result>
			<tkr_ref_uom>ug/g Creat</tkr_ref_uom>
			<tkr_lab_ref>&lt; 1</tkr_lab_ref>
		</tkr_det>
	</TK_test_seq>
</root>
