<?xml version="1.0" encoding="UTF-8"?>
<root xmlns:xsi="http://www.w3.org/2001/XMLSchema-instance"
      xsi:noNamespaceSchemaLocation="file:///c:/apps/HL7/src/SS_XML_Files/DONT_TOUCH/SS_BIOMED.xsd">
   <TK_test_seq>
      <test_mstr>
         <test_lab_ID>DDI</test_lab_ID>
      </test_mstr>
      <people_mstr>
         <people_lastname>Webber</people_lastname>
         <people_firstname>Matthew</people_firstname>
         <people_midname>S.</people_midname>
         <people_prefname/>
         <people_dob>
            <year>1991</year>
            <month>02</month>
            <day>02</day>
         </people_dob>
         <people_gender>M</people_gender>
         <people_ssn/>
         <people_homephone>207-374-5801</people_homephone>
         <people_workphone/>
      </people_mstr>
      <patient_mstr>
         <patient_notes>Comments - text area</patient_notes>
      </patient_mstr>
      <addr_mstr>
         <addr_addr1>PO Box 391</addr_addr1>
         <addr_addr2>Route 172</addr_addr2>
         <addr_city>Blue Hill</addr_city>
         <state_iso>ME</state_iso>
         <addr_zip>04614</addr_zip>
         <country_iso>USA</country_iso>
      </addr_mstr>
      <tk_mstr>
         <TK_ID>UTM-29142</TK_ID>
         <tk_lab_sample_ID>U150624-2073-1</tk_lab_sample_ID>
         <tk_test_desc>Urine Toxic Metals</tk_test_desc>
         <coll_begin>
            <year>2015</year>
            <month>06</month>
            <day>21</day>
         </coll_begin>
         <coll_end>
            <year>2015</year>
            <month>06</month>
            <day>25</day>
         </coll_end>
         <volume>10</volume>
      </tk_mstr>
      <tkr_det>
         <set_id>2</set_id>
         <tkr_item>U-Al/Creat</tkr_item>
         <tkr_result>7.6</tkr_result>
         <tkr_ref_uom>µg/g Creat</tkr_ref_uom>
         <tkr_lab_ref>&lt;     25</tkr_lab_ref>
      </tkr_det>
      <tkr_det>
         <set_id>3</set_id>
         <tkr_item>U-As/Creat</tkr_item>
         <tkr_result>10</tkr_result>
         <tkr_ref_uom>µg/g Creat</tkr_ref_uom>
         <tkr_lab_ref>&lt;     75</tkr_lab_ref>
      </tkr_det>
      <tkr_det>
         <set_id>4</set_id>
         <tkr_item>U-Ba/Creat</tkr_item>
         <tkr_result>2.5</tkr_result>
         <tkr_ref_uom>µg/g Creat</tkr_ref_uom>
         <tkr_lab_ref>&lt;      7</tkr_lab_ref>
      </tkr_det>
      <tkr_det>
         <set_id>5</set_id>
         <tkr_item>U-Be/Creat</tkr_item>
         <tkr_result>&lt; dl</tkr_result>
         <tkr_ref_uom>µg/g Creat</tkr_ref_uom>
         <tkr_lab_ref>&lt;      1</tkr_lab_ref>
      </tkr_det>
      <tkr_det>
         <set_id>6</set_id>
         <tkr_item>U-Bi/Creat</tkr_item>
         <tkr_result>&lt; dl</tkr_result>
         <tkr_ref_uom>µg/g Creat</tkr_ref_uom>
         <tkr_lab_ref>&lt;      2</tkr_lab_ref>
      </tkr_det>
      <tkr_det>
         <set_id>7</set_id>
         <tkr_item>U-Cd/Creat</tkr_item>
         <tkr_result>0.2</tkr_result>
         <tkr_ref_uom>µg/g Creat</tkr_ref_uom>
         <tkr_lab_ref>&lt;      0.8</tkr_lab_ref>
      </tkr_det>
      <tkr_det>
         <set_id>8</set_id>
         <tkr_item>U-Cs/Creat</tkr_item>
         <tkr_result>6.2</tkr_result>
         <tkr_ref_uom>µg/g Creat</tkr_ref_uom>
         <tkr_lab_ref>&lt;     8</tkr_lab_ref>
      </tkr_det>
      <tkr_det>
         <set_id>9</set_id>
         <tkr_item>U-Gd/Creat</tkr_item>
         <tkr_result>&lt; dl</tkr_result>
         <tkr_ref_uom>µg/g Creat</tkr_ref_uom>
         <tkr_lab_ref>&lt;    0.5</tkr_lab_ref>
      </tkr_det>
      <tkr_det>
         <set_id>10</set_id>
         <tkr_item>U-Hg/Creat</tkr_item>
         <tkr_result>&lt; dl</tkr_result>
         <tkr_ref_uom>µg/g Creat</tkr_ref_uom>
         <tkr_lab_ref>&lt;      3</tkr_lab_ref>
      </tkr_det>
      <tkr_det>
         <set_id>11</set_id>
         <tkr_item>U-Ni/Creat</tkr_item>
         <tkr_result>6.7</tkr_result>
         <tkr_ref_uom>µg/g Creat</tkr_ref_uom>
         <tkr_lab_ref>&lt;     6.7</tkr_lab_ref>
      </tkr_det>
      <tkr_det>
         <set_id>12</set_id>
         <tkr_item>U-Pb/Creat</tkr_item>
         <tkr_result>0.2</tkr_result>
         <tkr_ref_uom>µg/g Creat</tkr_ref_uom>
         <tkr_lab_ref>&lt;      2</tkr_lab_ref>
      </tkr_det>
      <tkr_det>
         <set_id>13</set_id>
         <tkr_item>U-Pd/Creat</tkr_item>
         <tkr_result>&lt; dl</tkr_result>
         <tkr_ref_uom>µg/g Creat</tkr_ref_uom>
         <tkr_lab_ref>&lt;   0.1</tkr_lab_ref>
      </tkr_det>
      <tkr_det>
         <set_id>14</set_id>
         <tkr_item>U-Pt/Creat</tkr_item>
         <tkr_result>&lt; dl</tkr_result>
         <tkr_ref_uom>µg/g Creat</tkr_ref_uom>
         <tkr_lab_ref>&lt;    0.1</tkr_lab_ref>
      </tkr_det>
      <tkr_det>
         <set_id>15</set_id>
         <tkr_item>U-Sb/Creat</tkr_item>
         <tkr_result>&lt; dl</tkr_result>
         <tkr_ref_uom>µg/g Creat</tkr_ref_uom>
         <tkr_lab_ref>&lt;    0.2</tkr_lab_ref>
      </tkr_det>
      <tkr_det>
         <set_id>16</set_id>
         <tkr_item>U-Sn/Creat</tkr_item>
         <tkr_result>2.5</tkr_result>
         <tkr_ref_uom>µg/g Creat</tkr_ref_uom>
         <tkr_lab_ref>&lt;      4</tkr_lab_ref>
      </tkr_det>
      <tkr_det>
         <set_id>17</set_id>
         <tkr_item>U-Te/Creat</tkr_item>
         <tkr_result>&lt; dl</tkr_result>
         <tkr_ref_uom>µg/g Creat</tkr_ref_uom>
         <tkr_lab_ref>&lt;    0.5</tkr_lab_ref>
      </tkr_det>
      <tkr_det>
         <set_id>18</set_id>
         <tkr_item>U-Th/Creat</tkr_item>
         <tkr_result>&lt; dl</tkr_result>
         <tkr_ref_uom>µg/g Creat</tkr_ref_uom>
         <tkr_lab_ref>&lt;   0.03</tkr_lab_ref>
      </tkr_det>
      <tkr_det>
         <set_id>19</set_id>
         <tkr_item>U-Tl/Creat</tkr_item>
         <tkr_result>0.3</tkr_result>
         <tkr_ref_uom>µg/g Creat</tkr_ref_uom>
         <tkr_lab_ref>&lt;    0.5</tkr_lab_ref>
      </tkr_det>
      <tkr_det>
         <set_id>20</set_id>
         <tkr_item>U-U/Creat</tkr_item>
         <tkr_result>&lt; dl</tkr_result>
         <tkr_ref_uom>µg/g Creat</tkr_ref_uom>
         <tkr_lab_ref>&lt;   0.03</tkr_lab_ref>
      </tkr_det>
      <tkr_det>
         <set_id>21</set_id>
         <tkr_item>U-W/Creat</tkr_item>
         <tkr_result>0.03</tkr_result>
         <tkr_ref_uom>µg/g Creat</tkr_ref_uom>
         <tkr_lab_ref>&lt;    0.4</tkr_lab_ref>
      </tkr_det>
      <tkr_det>
         <set_id>22</set_id>
         <tkr_item>U-CREAT</tkr_item>
         <tkr_result>83.1</tkr_result>
         <tkr_ref_uom>mg/dL</tkr_ref_uom>
         <tkr_lab_ref>35-   240</tkr_lab_ref>
      </tkr_det>
      <tkr_det>
         <set_id>23</set_id>
         <tkr_item>U-Vol 24hr</tkr_item>
         <tkr_result/>
         <tkr_ref_uom>mL</tkr_ref_uom>
         <tkr_lab_ref/>
      </tkr_det>
      <tkr_det>
         <set_id>24</set_id>
         <tkr_item>Col Period</tkr_item>
         <tkr_result>timed: 6 hours</tkr_result>
         <tkr_ref_uom>Hours</tkr_ref_uom>
         <tkr_lab_ref/>
      </tkr_det>
      <tkr_det>
         <set_id>25</set_id>
         <tkr_item>Provocation</tkr_item>
         <tkr_result>POST PROVOCATIVE</tkr_result>
         <tkr_ref_uom/>
         <tkr_lab_ref/>
      </tkr_det>
   </TK_test_seq>
</root>